{
  "schema_version": "1.0",
  "timestamp": "2026-09-13T02:20:00Z",
  "event_id": "a0000000-0000-4000-8000-000000000001",
  "edge_site": "pune",
  "namespace": "local-compose",
  "service": "edge-api",
  "event_type": "service_request",
  "severity": "info",
  "source": "192.168.1.100",
  "destination": null,
  "message": "Standard HTTP GET /health request processed successfully",
  "metadata": {}
}
